{
  "id": "SLPM_602.46",
  "cover": {
    "path": "PS2/SLPM_602.46/SLPM_602.46_COV.png",
    "kind": "cover",
    "bytes": 96165,
    "width": 192,
    "height": 272,
    "sha256": "f31ea00b608846280739b30f39eb81ed1352e702b149fd43f037a2a2e5fd6b90",
    "source": {
      "id": "xlenore-ps2-covers",
      "path": "covers/default/SLPM-60246.jpg"
    },
    "gameId": "SLPM_602.46"
  },
  "disc": null,
  "background": null,
  "backgrounds": [],
  "alternatives": {
    "covers": [],
    "discs": []
  },
  "extras": []
}
